{
  "schema_version": "2.0.0",
  "model_id": "TC-MODEL-MULTI-ENTRY",
  "root_title": "临底汇总指定弹窗列宽记忆",
  "branch_count": 3,
  "execution_instance_count": 3,
  "execution_instances": [
    {"execution_instance_id":"EXEC-001","tc_id":"TC001","branch_id":"TC001-B01","execution_status":"not_run","executor":null,"executed_at":null,"defect_ids":[],"rerun_of":null,"execution_evidence":null},
    {"execution_instance_id":"EXEC-002","tc_id":"TC001","branch_id":"TC001-B02","execution_status":"not_run","executor":null,"executed_at":null,"defect_ids":[],"rerun_of":null,"execution_evidence":null},
    {"execution_instance_id":"EXEC-003","tc_id":"TC001","branch_id":"TC001-B03","execution_status":"not_run","executor":null,"executed_at":null,"defect_ids":[],"rerun_of":null,"execution_evidence":null}
  ],
  "cases": [
    {
      "tc_id": "TC001",
      "dimension": "功能测试",
      "common_entry": "临底汇总指定弹窗",
      "module_level_1": null,
      "module_level_2": null,
      "test_point": "汇总三个 T0 相关弹窗均支持列宽记忆",
      "steps": [],
      "expected_results": [],
      "entry_branches": [
        {
          "branch_id": "TC001-B01",
          "entry_name": "临底-汇总-T0股/T0底仓弹窗",
          "steps": ["调整 T0 利额列宽，关闭弹窗后再次打开"],
          "expected_results": ["恢复当前账号最近调整的 T0 利额列宽，悬浮框整体宽度与列宽匹配"]
        },
        {
          "branch_id": "TC001-B02",
          "entry_name": "持“底+T”合盈弹窗",
          "steps": ["调整 T0 利额列宽，关闭弹窗后再次打开"],
          "expected_results": ["恢复当前账号最近调整的 T0 利额列宽，悬浮框整体宽度与列宽匹配"]
        },
        {
          "branch_id": "TC001-B03",
          "entry_name": "清“底+T”合盈弹窗",
          "steps": ["调整 T0 利额列宽，关闭弹窗后再次打开"],
          "expected_results": ["恢复当前账号最近调整的 T0 利额列宽，悬浮框整体宽度与列宽匹配"]
        }
      ],
      "risk_ids": ["RISK-MULTI-001"],
      "requirement_ids": ["REQ-MULTI-001"],
      "change_ids": [],
      "historical_defect_ids": [],
      "test_priority": "P1",
      "evidence_state": "已确认",
      "regression_scope": "关联回归",
      "deduplication_key": "临底汇总指定弹窗|列宽记忆|RISK-MULTI-001"
    }
  ]
}
