{
  "schema_version": "2.0.0",
  "model_id": "TC-MODEL-CLEARANCE-PERMISSION-20260718",
  "root_title": "清仓股弹窗权限",
  "branch_count": 0,
  "execution_instance_count": 0,
  "execution_instances": [],
  "cases": [
    {
      "tc_id": "TC001",
      "dimension": "权限测试",
      "common_entry": "汇总卡片弹窗",
      "module_level_1": null,
      "module_level_2": null,
      "test_point": "无权限股票行过滤",
      "steps": [
        "打开模拟交易清仓股弹窗，准备同时包含有权和无权股票的数据"
      ],
      "expected_results": [
        "列表仅展示权限命中的股票；无权数据不出现在列表、分页结果和刷新结果中"
      ],
      "risk_ids": [
        "RISK-001"
      ],
      "requirement_ids": [
        "REQ002"
      ],
      "change_ids": [],
      "historical_defect_ids": [],
      "test_priority": "P0",
      "evidence_state": "已确认",
      "regression_scope": "核心回归",
      "deduplication_key": "模拟交易清仓股弹窗|无权限股票行过滤|RISK-001"
    },
    {
      "tc_id": "TC002",
      "dimension": "权限测试",
      "common_entry": "汇总卡片弹窗",
      "module_level_1": null,
      "module_level_2": null,
      "test_point": "无权限股票行过滤",
      "steps": [
        "打开正式交易清仓股弹窗，准备同时包含有权和无权股票的数据"
      ],
      "expected_results": [
        "列表仅展示权限命中的股票；无权数据不出现在列表、分页结果和刷新结果中"
      ],
      "risk_ids": [
        "RISK-002"
      ],
      "requirement_ids": [
        "REQ002"
      ],
      "change_ids": [],
      "historical_defect_ids": [],
      "test_priority": "P0",
      "evidence_state": "已确认",
      "regression_scope": "核心回归",
      "deduplication_key": "正式交易清仓股弹窗|无权限股票行过滤|RISK-002"
    },
    {
      "tc_id": "TC003",
      "dimension": "权限测试",
      "common_entry": "汇总卡片弹窗",
      "module_level_1": null,
      "module_level_2": null,
      "test_point": "模拟交易策略段权限隔离",
      "steps": [
        "建仓人=A；清仓策略建仓人=A，清后重建建仓人=B；以A查看两个策略段"
      ],
      "expected_results": [
        "清仓策略段可见；清后重建策略段不可见；两个策略段独立控权"
      ],
      "risk_ids": [
        "RISK-004"
      ],
      "requirement_ids": [
        "REQ004"
      ],
      "change_ids": [],
      "historical_defect_ids": [],
      "test_priority": "P0",
      "evidence_state": "已确认",
      "regression_scope": "核心回归",
      "deduplication_key": "模拟交易清仓股弹窗|模拟交易策略段权限隔离|RISK-004"
    },
    {
      "tc_id": "TC004",
      "dimension": "权限测试",
      "common_entry": "汇总卡片弹窗",
      "module_level_1": null,
      "module_level_2": null,
      "test_point": "正式交易策略段权限隔离",
      "steps": [
        "建仓人=A；清仓策略建仓人=A，清后重建建仓人=B；以A查看两个策略段"
      ],
      "expected_results": [
        "清仓策略段可见；清后重建策略段不可见；两个策略段独立控权"
      ],
      "risk_ids": [
        "RISK-004"
      ],
      "requirement_ids": [
        "REQ004"
      ],
      "change_ids": [],
      "historical_defect_ids": [],
      "test_priority": "P0",
      "evidence_state": "已确认",
      "regression_scope": "核心回归",
      "deduplication_key": "正式交易清仓股弹窗|正式交易策略段权限隔离|RISK-004"
    },
    {
      "tc_id": "TC005",
      "dimension": "权限测试",
      "common_entry": "汇总卡片弹窗",
      "module_level_1": null,
      "module_level_2": null,
      "test_point": "模拟交易股票行与汇总行权限口径",
      "steps": [
        "准备有权和无权股票行，记录可见行各汇总字段；打开弹窗查看列表和汇总行"
      ],
      "expected_results": [
        "无权股票不进入列表；将可见股票行各统计字段逐项汇总后，与汇总行对应字段一致"
      ],
      "risk_ids": [
        "RISK-003"
      ],
      "requirement_ids": [
        "REQ003"
      ],
      "change_ids": [],
      "historical_defect_ids": [],
      "test_priority": "P0",
      "evidence_state": "已确认",
      "regression_scope": "核心回归",
      "deduplication_key": "模拟交易清仓股弹窗|模拟交易股票行与汇总行权限口径|RISK-003"
    },
    {
      "tc_id": "TC006",
      "dimension": "权限测试",
      "common_entry": "汇总卡片弹窗",
      "module_level_1": null,
      "module_level_2": null,
      "test_point": "正式交易股票行与汇总行权限口径",
      "steps": [
        "准备有权和无权股票行，记录可见行各汇总字段；打开弹窗查看列表和汇总行"
      ],
      "expected_results": [
        "无权股票不进入列表；将可见股票行各统计字段逐项汇总后，与汇总行对应字段一致"
      ],
      "risk_ids": [
        "RISK-003"
      ],
      "requirement_ids": [
        "REQ003"
      ],
      "change_ids": [],
      "historical_defect_ids": [],
      "test_priority": "P0",
      "evidence_state": "已确认",
      "regression_scope": "核心回归",
      "deduplication_key": "正式交易清仓股弹窗|正式交易股票行与汇总行权限口径|RISK-003"
    },
    {
      "tc_id": "TC007",
      "dimension": "权限测试",
      "common_entry": "汇总卡片弹窗",
      "module_level_1": null,
      "module_level_2": null,
      "test_point": "role_type 映射",
      "steps": [
        "准备同一批次存在三类 role_type 角色数据；配置建仓人和跟进人权限后查看股票行"
      ],
      "expected_results": [
        "建仓人权限只匹配 10/20；跟进人权限只匹配 30；同批次多个 role_type 按配置条件判断，不发生跨角色越权"
      ],
      "risk_ids": [
        "RISK-005"
      ],
      "requirement_ids": [
        "REQ005"
      ],
      "change_ids": [],
      "historical_defect_ids": [],
      "test_priority": "P0",
      "evidence_state": "已确认",
      "regression_scope": "核心回归",
      "deduplication_key": "清仓股弹窗|role_type 映射|RISK-005"
    },
    {
      "tc_id": "TC008",
      "dimension": "权限测试",
      "common_entry": "汇总卡片弹窗",
      "module_level_1": null,
      "module_level_2": null,
      "test_point": "四类权限和关系条件配置",
      "steps": [
        "进入清仓股弹窗行权限配置；检查权限类型关系条件目标值控件"
      ],
      "expected_results": [
        "存在四类新权限；普通建仓人/跟进人支持等于、不等于、包含于、不包含、完全包含于；指定用户支持包含于、不包含"
      ],
      "risk_ids": [
        "RISK-006"
      ],
      "requirement_ids": [
        "REQ001"
      ],
      "change_ids": [],
      "historical_defect_ids": [],
      "test_priority": "P1",
      "evidence_state": "已确认",
      "regression_scope": "关联回归",
      "deduplication_key": "清仓股弹窗权限配置|四类权限和关系条件配置|RISK-006"
    },
    {
      "tc_id": "TC009",
      "dimension": "权限测试",
      "common_entry": "汇总卡片弹窗",
      "module_level_1": null,
      "module_level_2": null,
      "test_point": "指定用户多选追加",
      "steps": [
        "选择建仓人（指定用户）或跟进人（指定用户），依次追加多个用户"
      ],
      "expected_results": [
        "已选用户列表包含本次追加的多个用户"
      ],
      "risk_ids": [
        "RISK-006"
      ],
      "requirement_ids": [
        "REQ001"
      ],
      "change_ids": [],
      "historical_defect_ids": [],
      "test_priority": "P1",
      "evidence_state": "已确认",
      "regression_scope": "关联回归",
      "deduplication_key": "汇总卡片弹窗|指定用户权限|多用户追加|选择|已选列表包含追加用户|RISK-006"
    },
    {
      "tc_id": "TC010",
      "dimension": "权限测试",
      "common_entry": "汇总卡片弹窗",
      "module_level_1": null,
      "module_level_2": null,
      "test_point": "原有权限保留",
      "steps": [
        "在已有原权限配置的账号上新增一条新权限；重新打开模拟交易清仓股弹窗"
      ],
      "expected_results": [
        "原权限仍可用；新增权限不覆盖原有可见数据"
      ],
      "risk_ids": [
        "RISK-007"
      ],
      "requirement_ids": [
        "REQ007"
      ],
      "change_ids": [],
      "historical_defect_ids": [],
      "test_priority": "P1",
      "evidence_state": "已确认",
      "regression_scope": "关联回归",
      "deduplication_key": "模拟交易清仓股弹窗|原有权限保留|RISK-007"
    },
    {
      "tc_id": "TC011",
      "dimension": "权限测试",
      "common_entry": "汇总卡片弹窗",
      "module_level_1": null,
      "module_level_2": null,
      "test_point": "可用资金弹窗不受影响",
      "steps": [
        "使用同一账号和查询条件记录变更前基线；新增清仓股权限后重新打开可用资金弹窗"
      ],
      "expected_results": [
        "变更前后可用资金弹窗的可见范围、行数、可用资金字段和汇总字段逐项一致"
      ],
      "risk_ids": [
        "RISK-007"
      ],
      "requirement_ids": [
        "REQ008"
      ],
      "change_ids": [],
      "historical_defect_ids": [],
      "test_priority": "P1",
      "evidence_state": "已确认",
      "regression_scope": "关联回归",
      "deduplication_key": "可用资金弹窗|可用资金弹窗不受影响|RISK-007"
    },
    {
      "tc_id": "TC012",
      "dimension": "权限测试",
      "common_entry": "汇总卡片弹窗",
      "module_level_1": null,
      "module_level_2": null,
      "test_point": "包含于和完全包含于命中范围",
      "steps": [
        "同批次角色{A满足，B不满足}；配置“包含于”并查看股票行",
        "保持同一数据，改为“完全包含于”；再将A、B均调整为满足"
      ],
      "expected_results": [
        "任一角色满足时股票行可见",
        "仅A满足时不可见；A、B均满足时可见"
      ],
      "risk_ids": [
        "RISK-008"
      ],
      "requirement_ids": [
        "REQ006"
      ],
      "change_ids": [],
      "historical_defect_ids": [],
      "test_priority": "P1",
      "evidence_state": "已确认",
      "regression_scope": "关联回归",
      "deduplication_key": "清仓股弹窗|包含于和完全包含于命中范围|RISK-008"
    },
    {
      "tc_id": "TC013",
      "dimension": "权限测试",
      "common_entry": "汇总卡片弹窗",
      "module_level_1": null,
      "module_level_2": null,
      "test_point": "多条件 AND 组合",
      "steps": [
        "配置多个新旧权限条件并使用 AND，查看同时满足和仅满足部分条件的数据"
      ],
      "expected_results": [
        "仅同时满足全部 AND 条件的数据可见；原有权限按配置规则参与判断"
      ],
      "risk_ids": [
        "RISK-008"
      ],
      "requirement_ids": [
        "REQ007"
      ],
      "change_ids": [],
      "historical_defect_ids": [],
      "test_priority": "P1",
      "evidence_state": "已确认",
      "regression_scope": "关联回归",
      "deduplication_key": "清仓股弹窗|多条件 AND 组合|RISK-008"
    },
    {
      "tc_id": "TC014",
      "dimension": "权限测试",
      "common_entry": "汇总卡片弹窗",
      "module_level_1": null,
      "module_level_2": null,
      "test_point": "多条件 OR 组合",
      "steps": [
        "配置多个新旧权限条件并使用 OR，查看满足单个条件和完全不满足条件的数据"
      ],
      "expected_results": [
        "满足任一 OR 条件的数据可见；完全不满足条件的数据不可见；原有权限按配置规则参与判断"
      ],
      "risk_ids": [
        "RISK-008"
      ],
      "requirement_ids": [
        "REQ007"
      ],
      "change_ids": [],
      "historical_defect_ids": [],
      "test_priority": "P1",
      "evidence_state": "已确认",
      "regression_scope": "关联回归",
      "deduplication_key": "清仓股弹窗|多条件 OR 组合|RISK-008"
    }
  ]
}
